{
  "schemaVersion": "samsarix-field-atlas/suite-change-plan/1",
  "mode": "declared-contract-change",
  "suiteId": "core-reference-scenarios",
  "baselineSha256": "52994c82ddadbde841ebf5abfd7ef6b1a057dfea67186b26d7827fd680728f87",
  "owner": "Samsarix Platform Contracts",
  "reference": "urn:samsarix:field-atlas:example:tag-rollout",
  "expiresOn": "2026-09-01",
  "rationale": "Exercise the bounded change-intent workflow with one planned tag addition and the resulting manifest binding change.",
  "expectations": [
    {
      "caseId": "incident",
      "change": "modified",
      "impact": "review",
      "dimensions": ["tags"],
      "regressionAcknowledged": false,
      "rationale": "Mark the incident scenario as release-critical without changing its executable or conformance claims."
    }
  ],
  "suite": {
    "reportImpact": "none",
    "suiteMetadataChanged": false,
    "policyChanged": false,
    "manifestChanged": true
  },
  "proofBoundary": "This repository-owned example records declared intent only. Its owner and reference are assertions, not authenticated approval or permission to release."
}
